{
  "chapter": 2,
  "persona": "fanqie_碎片阅读者",
  "reader_scores": {
    "continue_reading": {"score": 5, "weight": 0.30, "reason": "必须看下一章，那个地下室到底藏了什么", "evidence": "门后传来低沉的嗡鸣声，像是什么东西在呼吸。"},
    "hook_effectiveness": {"score": 5, "weight": 0.25, "reason": "完全没想到地下室会通向那里，这个反转太意外了", "evidence": "他推开门，入目的不是黑暗——而是一片星空。"},
    "skip_urge": {"score": 4, "weight": 0.20, "reason": "整体节奏紧凑，只有中间配角对话稍长", "evidence": "fixture"},
    "confusion": {"score": 4, "weight": 0.05, "reason": "基本清晰，但血字含义没完全解释", "evidence": "fixture"},
    "empathy": {"score": 4, "weight": 0.10, "reason": "这章主角有了明确目标，开始在乎他的处境了", "evidence": "陆沉握紧拳头：不管那是什么，我都要进去看一眼。"},
    "freshness": {"score": 4, "weight": 0.10, "reason": "地下室通星空的设定没见过，有新鲜感", "evidence": "他推开门，入目的不是黑暗——而是一片星空。"}
  },
  "overall_engagement": 4.55,
  "suspicious_skim_paragraphs": [],
  "emotional_arc": {
    "sample_points": [
      {"position_pct": 0, "intensity": 4, "emotion": "期待"},
      {"position_pct": 25, "intensity": 3, "emotion": "紧张"},
      {"position_pct": 50, "intensity": 4, "emotion": "好奇"},
      {"position_pct": 75, "intensity": 5, "emotion": "兴奋"},
      {"position_pct": 100, "intensity": 5, "emotion": "焦虑"}
    ],
    "arc_shape": "上升型",
    "lowest_point_pct": 25,
    "peak_point_pct": 100,
    "arc_warning": null
  },
  "platform_signal": {
    "platform": "fanqie",
    "signals": {
      "completion_prediction": "high",
      "three_day_retention": "high",
      "binge_urge": "high"
    },
    "one_line_verdict": "午休时间到了但我假装没听到闹钟"
  },
  "golden_chapter_flags": [],
  "reader_feedback": "比第一章好很多，节奏快了，主角也立起来了。那个星空门必须马上看第三章。"
}
