{
  "chapter": 1,
  "persona": "fanqie_碎片阅读者",
  "reader_scores": {
    "continue_reading": {"score": 4, "weight": 0.30, "reason": "结尾那个反转让我很想知道接下来怎样", "evidence": "他猛地回头，身后的人影已经消失——但墙上多了一行血字。"},
    "hook_effectiveness": {"score": 4, "weight": 0.25, "reason": "血字悬念确实没想到，但稍微有点老套", "evidence": "墙上多了一行血字。"},
    "skip_urge": {"score": 3, "weight": 0.20, "reason": "第三段灵气等级说明太长，我差点跳过", "evidence": "灵气共分为九个大境界，每个境界又细分三小阶……"},
    "confusion": {"score": 5, "weight": 0.05, "reason": "完全看得懂，没有需要回翻的地方", "evidence": "fixture"},
    "empathy": {"score": 3, "weight": 0.10, "reason": "主角还没立住，暂时只是在看热闹", "evidence": "陆沉皱了皱眉，转身离开。"},
    "freshness": {"score": 4, "weight": 0.10, "reason": "开头的驿站设定有点新意，不是常见的宗门开局", "evidence": "荒废的驿站里堆满了无人认领的包裹，每一个都贴着同一个日期。"}
  },
  "overall_engagement": 3.75,
  "suspicious_skim_paragraphs": [
    {
      "paragraph_index": 3,
      "opening_words": "灵气共分为九个大境界，每个境界又",
      "reason": "纯设定说明约 250 字，与当前冲突无关",
      "severity": "medium"
    }
  ],
  "emotional_arc": {
    "sample_points": [
      {"position_pct": 0, "intensity": 3, "emotion": "好奇"},
      {"position_pct": 20, "intensity": 2, "emotion": "无聊"},
      {"position_pct": 40, "intensity": 3, "emotion": "紧张"},
      {"position_pct": 60, "intensity": 4, "emotion": "兴奋"},
      {"position_pct": 80, "intensity": 4, "emotion": "期待"},
      {"position_pct": 100, "intensity": 5, "emotion": "焦虑"}
    ],
    "arc_shape": "V型",
    "lowest_point_pct": 20,
    "peak_point_pct": 100,
    "arc_warning": null
  },
  "platform_signal": {
    "platform": "fanqie",
    "signals": {
      "completion_prediction": "high",
      "three_day_retention": "medium",
      "binge_urge": "high"
    },
    "one_line_verdict": "地铁到站了但我没下车"
  },
  "golden_chapter_flags": [
    {"flag": "empathy_weak", "detail": "主角人设尚未立住，代入感不够强，碎片读者可能第二章就流失"}
  ],
  "reader_feedback": "开头抓人，中间有一段差点走神，但结尾的悬念把我拉回来了。明天应该还会来看。"
}
